Id_peli;Titulo;Popularidad;Rating;Fecha;Duracion;Pais;Idioma;Presupuesto;Ganancia;Generos;Director;Casting;Guion;Montaje;DOP;Resumen
11644;Blow Out;14.335;7.3;1981;108;United States of America;English;18000000;12000000;['Crime', 'Drama', 'Mystery', 'Thriller'];['Brian De Palma'];['John Travolta', 'Nancy Allen', 'John Lithgow', 'Dennis Franz', 'Peter Boyden', 'Curt May', 'John Aquino', 'John McMartin', 'Deborah Everton', 'J. Patrick McNamara', 'Missy Cleveland', 'Roger Wilson', 'Lori-Nan Engler', 'Barbara Sigel', 'David De Felice', 'Roberto Lombardi', 'Missy Crutchfield', 'Cindy Manion', 'Marcy Bigelman', 'Ann Kelly', 'Dean Bennett', 'John Coppolino Jr.', 'Archie Lang', 'Dave Roberts', 'Claire Carter', 'Maurice Copeland', 'John Hoffmeister', 'Thomas J. McCarthy', 'Reginald M. Wallace', 'Robert L. Penrose', 'Larry Woody', 'Dick McGarvin', 'Michael Borghese', 'Rossana Fichera', 'James Jeter', 'Luddy Tramontana', 'Sid Doherty', 'Milt Fields', 'Bud Seese', 'Maureen Sullivan', 'Brian Corrigan', 'Elaine Filoon', 'Robin Sherwood', 'Tim Choate', 'B.J. Cyrus', 'Dave DeAngelis', 'Thomas Finn', 'Tony Devon', 'Henry Cohen', 'Bernie Rachelle', 'William Tarman', 'Michael Tearson'];[];['Paul Hirsch'];['Vilmos Zsigmond'];Jack Terry is a master sound recordist who works on grade-B horror movies. Late one evening, he is recording sounds for use in his movies when he hears something unexpected through his sound equipment and records it. Curiosity gets the better of him when the media become involved, and he begins to unravel the pieces of a nefarious conspiracy. As he struggles to survive against his shadowy enemies and expose the truth, he does not know whom he can trust.
26030;Bob le Flambeur;7.01;7.3;1956;103;France;English;0;41010;['Drama', 'Action', 'Crime'];['Jean-Pierre Melville'];['Roger Duchesne', 'Isabelle Corey', 'Daniel Cauchy', 'André Garet', 'Gérard Buhr', 'Guy Decomble', 'Claude Cerval', 'Howard Vernon', 'Colette Fleury', 'Simone Paris', 'René Havard', 'Jean-Pierre Melville'];[];['Monique Bonnot'];['Henri Decaë'];In Paris, Bob Montagne is practically synonymous with gambling -- and winning. He is kind, classy and well-liked by virtually everyone in town, including police inspector Ledru. However, when Bob's luck turns sour, he begins to lose friends and makes the most desperate gamble of his life: to rob the Deauville casino during Grand Prix weekend, when the vaults are full. Unfortunately, Bob soon learns that the game is rigged and the cops are on to him.
475;Bonnie and Clyde;24.935;7.498;1967;110;United States of America;English;2500000;50700000;['Crime', 'Drama'];['Arthur Penn'];['Warren Beatty', 'Faye Dunaway', 'Michael J. Pollard', 'Gene Hackman', 'Estelle Parsons', 'Denver Pyle', 'Dub Taylor', 'Evans Evans', 'Gene Wilder', 'Mabel Cavitt', 'Patrick Cranshaw', 'Owen Bush', 'Clyde Howdy', 'Russ Marker', 'Ann Palmer', 'Ken Mayer'];[];['Dede Allen'];['Burnett Guffey'];In the 1930s, bored waitress Bonnie Parker falls in love with an ex-con named Clyde Barrow and together they start a violent crime spree through the country, stealing cars and robbing banks.
68;Brazil;12.764;7.684;1985;143;United Kingdom;English;15000000;9900000;['Comedy', 'Science Fiction'];['Terry Gilliam'];"['Jonathan Pryce', 'Kim Greist', 'Robert De Niro', 'Ian Holm', 'Bob Hoskins', 'Katherine Helmond', 'Michael Palin', 'Ian Richardson', 'Peter Vaughan', 'Jim Broadbent', 'Terry Gilliam', ""Derrick O'Connor"", 'Roger Ashton-Griffiths', 'John Pierce Jones', 'Barbara Hicks', 'Charles McKeown', 'Kathryn Pogson', 'Bryan Pringle', 'Nigel Planer', 'Terence Bayler', 'Gorden Kaye', 'Jack Purvis', 'Howard Lew Lewis', 'John Flanagan', 'Sheila Reid', 'Ray Cooper', 'Brian Miller', 'Simon Jones', 'Derek Deadman', 'Bill Wallis', 'Myrtle Devenish', 'Ann Way', 'Don Henderson', 'Oscar Quitak', 'Harold Innocent', 'John Grillo', 'Ralph Nossek', 'David Gant', 'James Coyle', 'Patrick Connor', 'Elizabeth Spender']";['Terry Gilliam', 'Tom Stoppard', 'Charles McKeown'];['Julian Doyle'];['Roger Pratt'];Low-level bureaucrat Sam Lowry escapes the monotony of his day-to-day life through a recurring daydream of himself as a virtuous hero saving a beautiful damsel. Investigating a case that led to the wrongful arrest and eventual death of an innocent man instead of wanted terrorist Harry Tuttle, he meets the woman from his daydream, and in trying to help her gets caught in a web of mistaken identities, mindless bureaucracy and lies.
67772;Come Back to the 5 & Dime, Jimmy Dean, Jimmy Dean;4.443;5.98;1982;109;United States of America;English;850000;840000;['Comedy', 'Drama'];['Robert Altman'];['Cher', 'Sandy Dennis', 'Karen Black', 'Sudie Bond', 'Kathy Bates', 'Marta Heflin', 'Mark Patton', 'Caroline Aaron', 'Gena Ramsel', 'Ann Risley', 'Dianne Turley Travis', 'Ruth Miller'];['Ed Graczyk'];['Jason Rosenfield'];['Pierre Mignot'];The Disciples of James Dean meet up on the anniversary of his death and mull over their lives in the present and in flashback, revealing the truth behind their complicated lives.
5066;Carry On Cleo;10.3;6.717;1964;94;United Kingdom;English;0;0;['Comedy'];['Gerald Thomas'];['Sid James', 'Kenneth Williams', 'Jim Dale', 'Amanda Barrie', 'Joan Sims', 'Kenneth Connor', 'Charles Hawtrey', 'Julie Stevens', 'Brian Oulton', 'Michael Ward', 'Francis de Wolff', 'Victor Maddern', 'Sheila Hancock', 'Jon Pertwee', 'Wanda Ventham'];[];['Archie Ludski'];['Alan Hume'];Two Brits—inventor Hengist Pod, and Horse, a brave and cunning fighter—are captured and enslaved by invading Romans and taken to Rome. One of their first encounters in Rome leaves Hengist being mistaken for a fighter, and gets drafted into the Royal Guard to protect Cleopatra.
22937;Carry On Up the Khyber;6.939;6.708;1968;88;United Kingdom;English;0;0;['Adventure', 'Comedy'];['Gerald Thomas'];['Sid James', 'Charles Hawtrey', 'Bernard Bresslaw', 'Kenneth Williams', 'Roy Castle', 'Joan Sims', 'Peter Butterworth', 'Terry Scott', 'Angela Douglas', 'Cardew Robinson', 'Julian Holloway', 'Peter Gilmore', 'Leon Thau', 'Wanda Ventham', 'Alexandra Dane', 'Michael Mellinger', 'Dominique Don', 'Derek Sydney', 'Steven Scott', 'David Spenser', 'Patrick Allen', 'Eve Eden', 'Valerie Leon'];['Talbot Rothwell'];['Alfred Roome'];['Ernest Steward'];Sir Sidney Ruff-Diamond looks after the British outpost near the Khybar pass. Protected by the kilted Third Foot and Mouth regiment, you would think they were safe, but the Khazi of Kalabar has other ideas—he wants all the British dead. But his troops fear the 'skirted-devils, who are rumoured not to wear any underwear.
95025;Casanova;0.857;2.0;1971;90;[];[];0;0;['Comedy'];['Dwayne Avery'];['Johnny Rocco', 'Jane Tsentas', 'Uschi Digard', 'Veada Van Ness', 'James Brand', 'Bruce Kimball', 'John Vincent', 'Jay Edwards', 'John Tull', 'Neola Graef', 'Debbie Osborne', 'Terri Johnson', 'Kathy Hilton', 'Ron Darby', 'Maria Arnold'];[];[];[];The Hilarious Escapades of an Infamous Lover!
25508;Cat People;14.144;6.929;1942;73;United States of America;English;134000;4000000;['Horror', 'Drama'];['Jacques Tourneur'];['Simone Simon', 'Kent Smith', 'Tom Conway', 'Jane Randolph', 'Jack Holt', 'Henrietta Burnside', 'Alec Craig', 'Eddie Dew', 'Elizabeth Dunne', 'Dot Farley', 'Mary Halsey', 'Theresa Harris', 'Charles Jordan', 'Donald Kerr', 'Connie Leon', 'Murdock MacQuarrie', 'Alan Napier', 'John Piffle', 'Betty Roadman', 'Elizabeth Russell', 'Stephen Soldi'];[];['Mark Robson'];['Nicholas Musuraca'];"Serbian fashion designer Irena Dubrovna and American marine engineer Oliver Reed meet in Central Park, fall in love, and marry after a brief courtship; but Irena won't consummate the union for fear that she will turn into a panther compelled to kill her lover, pursuant to a belief harbored by her home village."
97029;Ceddo;1.647;6.955;1977;112;Senegal;العربية;0;0;['Drama'];['Ousmane Sembène'];['Mamadou Dioumé', 'Ousmane Sembène', 'Tabata Ndiaye', 'Moustapha Yade', 'Ismaila Diagne', 'Matoura Dia', 'Omar Gueye', 'Nar Modou', 'Ousmane Camara'];[];['Florence Eymon'];['Georges Caristan'];When King Demba War sides with the Muslims, the Ceddo kidnap his daughter, Princess Dior Yacine, to protest their forcible conversion to Islam.
34796;City Girl;5.946;7.472;1930;88;United States of America;No Language;0;0;['Drama', 'Romance'];['F. W. Murnau'];"['Charles Farrell', 'Mary Duncan', 'David Torrence', 'Edith Yorke', 'Guinn ""Big Boy"" Williams', 'Anne Shirley', 'Tom McGuire', 'Richard Alexander', 'Patrick Rooney', 'Ed Brady', 'Roscoe Ates', 'Marjorie Beebe', 'Eddie Boland', 'Harry Gripp', 'Mark Hamilton', 'Werner Klingler', 'Charles Lane', 'Ivan Linow', 'Arnold Lucy', 'Helen Lynch', 'Michael Mark', 'Jack Pennick', 'David Rollins', 'William Sundholm']";[];['Katherine Hilliker', 'H.H. Caldwell'];['Ernest Palmer'];A waitress from Chicago falls in love with a man from rural Minnesota and marries him, with the intent of living a better life - but life on the farm has its own challenges.
28484;Colorado Territory;4.015;7.1;1949;94;United States of America;English;0;0;['Crime', 'Drama', 'Western', 'Romance'];['Raoul Walsh'];['Joel McCrea', 'Virginia Mayo', 'Dorothy Malone', 'Henry Hull', 'John Archer', 'James Mitchell', 'Morris Ankrum', 'Basil Ruysdael', 'Frank Puglia', 'Ian Wolfe', 'Harry Woods', 'Houseley Stevenson', 'Carl Andre', 'George Bell', 'Oliver Blake', 'Monte Blue', 'Ben Corbett', 'Jack Daley', 'Bert Dillard', 'Robert Filmer', 'Carl Harbaugh', 'Hallene Hill', 'Charles Horvath', 'Fred Kelsey', 'Victor Kilian', 'Paul Kruger', 'James Mitchum', 'Jack Montgomery', 'Merlyn Nelson', 'Artie Ortego', 'Joe Phillips', 'Maudie Prickett', 'Frosty Royce', 'Phil Schumacher', 'Harry Strang', 'Glen Thompson'];['Edmund H. North', 'John Twist'];['Owen Marks'];['Sidney Hickox'];In Colorado territory, outlaw Wes McQueen escapes jail to pull a railroad robbery but, upon meeting pretty settler Julie Ann, he wonders about going straight. Western remake of High Sierra with Joel McCrea taking over the Humphrey Bogart role.
61044;Compañeros;5.472;6.429;1970;118;Italy;Deutsch;0;0;['Action', 'Comedy', 'Western'];['Sergio Corbucci'];['Franco Nero', 'Tomas Milian', 'Jack Palance', 'Fernando Rey', 'Iris Berben', 'José Bódalo', 'Karin Schubert', 'Eduardo Fajardo', 'Gino Pernice', 'Tito García', 'Gérard Tichy', 'Lorenzo Robledo', 'Álvaro de Luna', 'Jesús Fernández', 'Claudio Scarchilli', 'Giovanni Petti', 'Gianni Pulone', 'Rafael Albaicín', 'Simón Arriaga', 'José Canalejas', 'Cantori Moderni Di Alessandroni', 'Ramón Fernández Tejela', 'Víctor Israel', 'José Luis Lizalde', 'José Marco', 'Antonio Padilla', 'Joaquín Parra', 'Vicente Roca'];['Sergio Corbucci', 'Massimo De Rita', 'Dino Maiuri', 'Fritz Ebert'];['Eugenio Alabiso'];['Alejandro Ulloa'];Arms dealer Yolaf Peterson aims to make a sale to guerilla Mongo, but the money is locked in a bank safe, the combination known only to Professor Xantos, a prisoner of the Americans. Yolaf agrees to free Xantos, accompanied by reluctant guerilla Basco, but a former business partner of Yolaf's- John 'The Wooden Hand', has other ideas.
9387;Conan the Barbarian;27.877;6.775;1982;129;United States of America;English;20000000;79114085;['Adventure', 'Fantasy', 'Action'];['John Milius'];['Arnold Schwarzenegger', 'James Earl Jones', 'Max von Sydow', 'Sandahl Bergman', 'Cassandra Gava', 'Ben Davidson', 'Gerry Lopez', 'Mako', 'Valérie Quennessen', 'William Smith', 'Luis Barboo', 'Franco Columbu', 'Nadiuska', 'Jack Taylor', 'Sven-Ole Thorsen', 'Pilar Alcón', 'Jorge Sanz', 'Celia Milius', 'Andrea Guzon', 'Leslie Foldvary', 'Sab Shimono'];['John Milius', 'Oliver Stone'];"[""Carroll Timothy O'Meara""]";['Duke Callaghan'];A film adaptation of the classic sword and sorcery hero, Conan the Barbarian. A horde of rampaging warriors massacre the parents of young Conan and enslave the young child for years on The Wheel of Pain. As the sole survivor of the childhood massacre, Conan is released from slavery and taught the ancient arts of fighting. Transforming himself into a killing machine, Conan travels into the wilderness to seek vengeance on Thulsa Doom, the man responsible for killing his family. In the wilderness, Conan takes up with the thieves Valeria and Subotai. The group comes upon King Osric, who wants the trio of warriors to help rescue his daughter who has joined Doom in the hills.
10238;Cries and Whispers;13.887;8.0;1972;95;Sweden;svenska;400000;0;['Drama'];['Ingmar Bergman'];['Harriet Andersson', 'Ingrid Thulin', 'Kari Sylwan', 'Liv Ullmann', 'Erland Josephson', 'Anders Ek', 'Henning Moritzen', 'Georg Årlin', 'Ingmar Bergman', 'Ingrid Sandell', 'Ingrid Bergman', 'Linn Ullmann', 'Inga Gill', 'Greta Johansson', 'Marianne Aubert', 'Rossana Mariano', 'Malin Gjörup', 'Lena Bergman', 'Ann-Christin Lobråten', 'Börje Lundh', 'Lars-Owe Carlberg', 'Monika Priede'];['Ingmar Bergman'];['Siv Lundgren'];['Sven Nykvist'];As Agnes slowly dies of cancer, her sisters are so deeply immersed in their own psychic pains that they can't offer her the support she needs. Maria is wracked with guilt at her husband's attempted suicide, caused by his discovery of her extramarital affair. The self-loathing, suicidal Karin seems to regard her sister with revulsion. Only Anna, the deeply religious maid who lost her young child, seems able to offer Agnes solace and empathy.
46919;Daisies;10.823;7.4;1966;76;Czechoslovakia;Český;0;0;['Comedy', 'Drama'];['Věra Chytilová'];['Jitka Cerhová', 'Ivana Karbanová', 'Julius Albert', 'Jan Klusák', 'Marie Češková', 'Jiřina Myšková', 'Marcela Březinová', 'Oldřich Hora', 'Václav Chochola', 'Jaromír Vomáčka', 'Josef Koníček', 'František Uldrich', 'Oldřich Bašus', 'A. Drábek', 'J. Hrubý', 'Robert Kühnel', 'J. Laufer', 'L. Nedvěd', 'J. Pech', 'J. Tesárek', 'J. Bartoš', 'Miloslava Babůrková', 'V. Zikmund', 'Jiří Menzel'];['Věra Chytilová', 'Ester Krumbachová'];['Miroslav Hájek'];['Jaroslav Kučera'];Two teenage girls embark on a series of destructive pranks in which they consume and destroy the world around them.
581;Dances with Wolves;24.853;7.858;1990;181;United Kingdom;English;22000000;424208848;['Adventure', 'Drama', 'Western'];['Kevin Costner'];['Kevin Costner', 'Mary McDonnell', 'Graham Greene', 'Rodney A. Grant', 'Floyd Red Crow Westerman', 'Tantoo Cardinal', 'Robert Pastorelli', 'Charles Rocket', 'Maury Chaykin', 'Jimmy Herman', 'Nathan Lee Chasing His Horse', 'Michael Spears', 'Jason R. Lone Hill', 'Tony Pierce', 'Doris Leader Charge', 'Tom Everett', 'Larry Joshua', 'Kirk Baltz', 'Wayne Grace', 'Donald Hotton', 'Annie Costner', 'Conor Duffy', 'Elisa Daniel', 'Percy White Plume', 'John Tail', 'Steve Reevis', 'Sheldon Peters Wolfchild', 'Wes Studi', 'Buffalo Child', 'Clayton Big Eagle', 'Richard Leader Charge', 'Redwing Ted Nez', 'Marvin Holy', 'Raymond Newholy', 'David J. Fuller', 'Ryan White Bull', 'Otakuye Conroy', 'Maretta Big Crow', 'Steven Chambers', 'William H. Burton Jr.', 'Bill W. Curry', 'Nick Thompson', 'Carter Hanner', 'Kent Hays', 'Robert Goldman', 'Frank P. Costanza', 'James A. Mitchell', 'R. L. Curtin', 'Justin', 'Teddy', 'Buck'];['Michael Blake'];['William Hoy', 'Neil Travis', 'Steve Potter', 'Chip Masamitsu'];['Dean Semler'];Wounded Civil War soldier, John Dunbar tries to commit suicide—and becomes a hero instead. As a reward, he's assigned to his dream post, a remote junction on the Western frontier, and soon makes unlikely friends with the local Sioux tribe.
8408;Day of the Dead;15.356;7.0;1985;101;United States of America;English;3500000;34000000;['Horror', 'Mystery', 'Drama'];['George A. Romero'];"['Lori Cardille', 'Anthony Dileo Jr.', 'Phillip G. Kellams', 'Debra Gordon', 'John Amplas', 'Joseph Pilato', 'Jarlath Conroy', 'Richard Liberty', 'Terry Alexander', 'Sherman Howard', 'Taso N. Stavrakis', 'Ralph Marrero', 'Gary Klar', 'Gregory Nicotero', 'Don Brockett', 'William Cameron', 'Deborah Carter', 'Winnie Flynn', 'Jeff Hogan', 'Barbara Holmes', 'David Kindlon', 'Bruce Kirkpatrick', ""'Wild Bill' Laczko"", 'Susan Martinelli', 'Kim Maxwell', 'Barbara Russell', 'Gene A. Saraceni', 'John D. Schwartz', 'Mark Tierno', 'Mike Trcic', 'John Vulich', 'Terry Adams', 'Howard Berger', 'Joe Abeln', 'Tom Ardolino', 'Al Anderson', 'Everett Burrell', 'Vini Bancalari', 'Gary A. Jones', 'Michael Deak', 'George A. Romero', 'Geoff Burkman', 'Tom Savini', 'Peter Iasillo Jr.', 'Al Magliochetti', 'Gabriel Bartalos']";['George A. Romero'];['Pasquale Buba'];['Michael Gornick'];Trapped in a missile silo, a small team of scientists, civilians, and trigger-happy soldiers battle desperately to ensure the survival of the human race. However, the tension inside the base is reaching a breaking point, and the zombies are gathering outside.
41391;Day of Wrath;6.539;8.029;1943;97;Denmark;Dansk;0;0;['Drama'];['Carl Theodor Dreyer'];['Thorkild Roose', 'Lisbeth Movin', 'Preben Lerdorff Rye', 'Sigrid Neiiendam', 'Anna Svierkier', 'Albert Høeberg', 'Olaf Ussing', 'Preben Neergaard', 'Kirsten Andreasen', 'Sigurd Berg', 'Harald Holst', 'Emanuel Jørgensen', 'Sophie Knudsen', 'Emilie Nielsen', 'Hans Christian Sørensen', 'Dagmar Wildenbrück'];['Carl Theodor Dreyer'];['Edith Schlüssel', 'Anne Marie Petersen'];['Karl Andersson'];In a Danish village in the early 1600s, a young woman named Anne, whose mother was thought to be a witch, develops sympathy toward an old woman, Marte, who is accused of witchcraft. The intervention of Anne's older but kindly husband, Pastor Absalon saved her mother -- but now, urged on by his overbearing mother, he refuses to help Marte. When Absalon's son returns home and is attracted to Anne, it's a matter of time before her family destiny catches up with her.
77210;Design for Living;7.722;7.326;1933;91;United States of America;Français;0;0;['Comedy', 'Romance'];['Ernst Lubitsch'];"['Fredric March', 'Gary Cooper', 'Miriam Hopkins', 'Edward Everett Horton', 'Franklin Pangborn', 'Isabel Jewell', 'Jane Darwell', 'Wyndham Standing', 'Cosmo Kyrle Bellew', 'Lionel Belmore', 'Thomas Braidon', 'Nora Cecil', 'Émile Chautard', 'Mathilde Comont', ""Adrienne D'Ambricourt"", 'James Donlan', 'Harry Dunkinson', 'Estelle Etterre', 'Helena Phillips Evans', 'Charles K. French', 'Mary Gordon', 'Grace Hayle', 'Olaf Hytten', 'Armand Kaliz', 'Colin Kenny', 'Edmund Mortimer', 'George Savidan', 'Rolfe Sedan', 'Vernon Steele', 'Mrs. Treboal', 'Barry Winton', 'Florence Wix', 'William Worthington']";['Ben Hecht', 'Samuel Hoffenstein'];['Frances Marsh'];['Victor Milner'];An independent woman can't choose between the two men she loves.
8130;Desperately Seeking Susan;11.183;6.055;1985;104;United States of America;English;5000000;27400000;['Comedy', 'Drama'];['Susan Seidelman'];['Madonna', 'Rosanna Arquette', 'Aidan Quinn', 'Mark Blum', 'Robert Joy', 'Laurie Metcalf', 'Anna Levine Thomson', 'Will Patton', 'Steven Wright', 'John Turturro', 'Giancarlo Esposito', 'Richard Hell', 'Rockets Redglare', 'Annie Golden', 'Richard Edson', 'Ann Magnuson', 'John Lurie', 'Peter Maloney', 'Anne Carlisle', 'Victor Argo', 'José Angel Santana', 'Steve Bosh', 'Daisy Bradford', 'Mary Joy', 'Rosemary Hochschild', 'Iris Chacón Tapia', 'Shirley Stoler', 'J.B. Waters', 'Arto Lindsay', 'Henry Adler', 'Marty Gold', 'Michael R. Chin', 'Patrick John Hurley', 'Timothy Carhart', 'Curt Dempster', 'Shirley Kaplan', 'Lázaro Pérez', 'John Hoyt', 'Gary Ray', 'Gary Binkow', 'Michael Bramon', 'Joyce Griffen', 'Paul Austin', 'Richard S. Lowy', 'Donna Ritchie', 'Kim Chan', 'Michael Badalucco', 'Elie J. Boubli', 'Adele Bertei', 'Peter Castellotti', 'Wende Dasteel', 'Steve Eidel', 'Michael Kaufman', 'Ilene Kristen', 'Carol Leifer', 'Richard Portnow', 'Isabel García Lorca', 'Tim Ransom', 'Gilda Torterello', 'Stanley Burns', 'Sandy Dell', 'Robert Dahdah', 'Kevin Harris', 'David Kellman', 'Harsh Nayyar', 'Robert Shafran', 'Frank Stellato'];[];['Andrew Mondshein'];['Edward Lachman'];"Roberta is a bored suburban housewife who is fascinated with a woman, Susan, she only knows about by reading messages to and from her in the personals section of the newspaper. This fascination reaches a peak when an ad with the headline ""Desperately Seeking Susan"" proposes a rendezvous. Roberta goes too, and in a series of events involving amnesia and mistaken identity, steps into Susan's life."
280664;The Birth of a Nation;0.6;6.0;1973;70;Germany;English;0;0;['Drama'];['Klaus Wyborny'];['Klaus Wyborny', 'Nick Busch', 'Angelika Düsing', 'Peter Flak', 'Hannes Hatje', 'Christoph Hemmerling'];[];[];['Klaus Wyborny'];The film depicts, in an anecdotal, quasi-anthropological style, the efforts of a group of men in a desert to achieve some kind of social organisation. An opening title locates the action in Morocco, in 1911, the date evidently refers to the work of D.W. Griffith.
925;Do the Right Thing;14.084;7.778;1989;120;United States of America;Español;6500000;37295445;['Drama'];['Spike Lee'];['Danny Aiello', 'Ossie Davis', 'Ruby Dee', 'Richard Edson', 'Giancarlo Esposito', 'Rosie Perez', 'Martin Lawrence', 'Spike Lee', 'Bill Nunn', 'John Turturro', 'John Savage', 'Roger Guenveur Smith', 'Joie Lee', 'Steve White', 'Leonard L. Thomas', 'Christa Rivers', 'Robin Harris', 'Paul Benjamin', 'Frankie Faison', 'Samuel L. Jackson', 'Rick Aiello', 'Miguel Sandoval', 'Luis Antonio Ramos', 'Frank Vincent', 'Richard Habersham', 'Ginny Yang', 'Nicholas Turturro', 'Gwen McGee', 'Steve Park', 'Sherwin Park', 'Shawn Elliott', 'Diva Osorio', 'Chris Delaney', 'Angel Ramirez Jr.', 'Sixto Ramos', 'Nelson Vasquez', 'Travell Lee Toulson', 'Joel Nagle', 'David E. Weinberg', 'Yatte Brown', 'Mecca Brunson', 'Shawn Stainback', 'Soquana Wallace'];['Spike Lee'];['Barry Alexander Brown'];['Ernest R. Dickerson'];"Salvatore ""Sal"" Fragione is the Italian owner of a pizzeria in Brooklyn. A neighborhood local, Buggin' Out, becomes upset when he sees that the pizzeria's Wall of Fame exhibits only Italian actors. Buggin' Out believes a pizzeria in a black neighborhood should showcase black actors, but Sal disagrees. The wall becomes a symbol of racism and hate to Buggin' Out and to other people in the neighborhood, and tensions rise."
907;Doctor Zhivago;36.249;7.5;1965;200;Italy;English;11000000;111858363;['Drama', 'Romance', 'War'];['David Lean'];['Omar Sharif', 'Julie Christie', 'Geraldine Chaplin', 'Rod Steiger', 'Alec Guinness', 'Tom Courtenay', 'Siobhán McKenna', 'Ralph Richardson', 'Rita Tushingham', 'Adrienne Corri', 'Bernard Kay', 'Geoffrey Keen', 'Klaus Kinski', 'Jeffrey Rockland', 'Gérard Tichy', 'Noel Willman', 'Tarek Sharif', 'Jack MacGowran', 'Mark Eden', 'Erik Chitty', 'Roger Maxwell', 'Wolf Frees', 'Gwen Nelson', 'Lucy Westmore', 'Lili Muráti', 'Peter Madden', 'Luana Alcañiz', 'Emilio Carrer', 'José María Caffarel', 'Catherine Ellison', 'Víctor Israel', 'Inigo Jackson', 'Leo Lähteenmäki', 'María Martín', 'José Nieto', 'Ricardo Palacios', 'Ingrid Pitt', 'Robert Rietti', 'Virgilio Teixeira', 'María Vico', 'Pilar Gómez Ferrer', 'Aldo Sambrell'];['Robert Bolt'];['Norman Savage'];['Freddie Young'];The life of a Russian physician and poet who, although married to another, falls in love with a political activist's wife and experiences hardship during World War I and then the October Revolution.
33205;Dodes'ka-den;8.096;7.111;1970;140;Japan;日本語;0;0;['Drama'];['Akira Kurosawa'];['Yoshitaka Zushi', 'Kin Sugai', 'Toshiyuki Tonomura', 'Shinsuke Minami', 'Yûko Kusunoki', 'Junzaburō Ban', 'Kiyoko Tange', 'Michio Hino', 'Keiji Furuyama', 'Tappei Shimokawa', 'Kunie Tanaka', 'Jitsuko Yoshimura', 'Hisashi Igawa', 'Hideko Okiyama', 'Tatsuo Matsumura', 'Imari Tsuji', 'Tomoko Yamazaki', 'Masahiko Kametani', 'Hiroshi Akutagawa', 'Tomoko Naraoka', 'Noboru Mitani', 'Hiroyuki Kawase', 'Akemi Negishi', 'Eimei Esumi', 'Minoru Takashima', 'Kazuo Katô', 'Michiko Araki', 'Toki Shiozawa', 'Masakazu Kuwayama', 'Hiroshi Kiyama', 'Kōji Mitsui', 'Jerry Fujio', 'Masahiko Tanimura', 'Atsushi Watanabe', 'Kamatari Fujiwara', 'Sanji Kojima', 'Kayako Sono', 'Yoshiko Maki', 'Toshiko Sakurai', 'Toriko Takahara', 'Matsue Ono', 'Reiko Niimura', 'Akira Hitomi', 'Shôji Ichimura', 'Shin Ibuki', 'Masaya Nihei', 'Takashi Ebata', 'Minoko Kaizuka'];['Akira Kurosawa', 'Shinobu Hashimoto', 'Hideo Oguni'];['Reiko Kaneko'];['Takao Saitō'];"This film follows the daily lives of a group of people barely scraping by in a slum on the outskirts of Tokyo. Yet as desperate as their circumstances are, each of them—the homeless father and son envisioning their dream house; the young woman abused by her uncle; the boy who imagines himself a trolley conductor—finds reasons to carry on."
145438;House;1.186;5.083;1958;12;Poland;No Language;0;0;['Animation'];['Walerian Borowczyk', 'Jan Lenica'];['Ligia Branice'];[];['Krystyna Rutkowska'];[];An experimental short film by Walerian Borowczyk and Jan Lenica.
996;Double Indemnity;13.872;8.141;1944;107;United States of America;English;927262;2500000;['Crime', 'Drama', 'Mystery', 'Thriller'];['Billy Wilder'];['Fred MacMurray', 'Barbara Stanwyck', 'Edward G. Robinson', 'Porter Hall', 'Richard Gaines', 'Jean Heather', 'Tom Powers', 'Fortunio Bonanova', 'Byron Barr', 'John Berry', 'Raymond Chandler', 'Edmund Cobb', 'Kernan Cripps', 'Bess Flowers', 'Eddie Hall', 'Teala Loring', 'Sam McDaniel', 'Billy Mitchell', 'Clarence Muse', 'Douglas Spencer', 'John Philliber', 'Harold Garrison', 'James Adamson', 'Betty Farrington', 'George Magrill', 'Constance Purdy', 'Dick Rush', 'Floyd Shackelford', 'Oscar Smith', 'Miriam Nelson'];['Billy Wilder', 'Raymond Chandler'];['Doane Harrison'];['John F. Seitz'];A rich woman and a calculating insurance agent plot to kill her unsuspecting husband after he signs a double indemnity policy. Against a backdrop of distinctly Californian settings, the partners in crime plan the perfect murder to collect the insurance, which pays double if the death is accidental.
