Id_peli;Titulo;Popularidad;Rating;Fecha;Duracion;Pais;Idioma;Presupuesto;Ganancia;Generos;Director;Casting;Guion;Montaje;DOP;Resumen
15;Citizen Kane;26.015;8.027;1941;119;United States of America;English;839727;23218000;['Mystery', 'Drama'];['Orson Welles'];"['Orson Welles', 'Joseph Cotten', 'Dorothy Comingore', 'Ray Collins', 'George Coulouris', 'Agnes Moorehead', 'Paul Stewart', 'Ruth Warrick', 'Erskine Sanford', 'William Alland', 'Everett Sloane', 'Fortunio Bonanova', 'Gus Schilling', 'Philip Van Zandt', 'Georgia Backus', 'Harry Shannon', 'Sonny Bupp', 'Buddy Swan', 'Gregg Toland', 'Don Ackerman', 'Nat King Cole', 'Gino Corrado', 'Maurice Costello', 'Demetrius Alexis', 'Gene Coogan', 'Art Dupuis', 'Rudy Germane', 'Mike Lally', 'Walter Lawrence', 'John Northpole', 'Victor Romito', 'Bob Terry', 'William Alston', 'Jack Gargan', 'Bert Moorhouse', 'Carmen Laroux', 'Sam Ash', 'Buddy Messinger', 'Terrance Ray', 'Sally Corner', 'Walter Bacon', 'Herbert Corthell', 'Harry A. Bailey', 'Danny Borzage', 'J.J. Clark', 'Tom Coleman', 'Carl Deloro', 'Jack Egan', 'Robert Haines', 'Ludwig Lowry', 'John McCormack', 'Hercules Mendez', ""Paddy O'Flynn"", 'Sam Rice', 'Don Roberts', 'Larry Wheat', 'Larry Williams', 'Joan Blair', 'Morgan Brown', 'Harry Burkhardt', 'Edmund Cobb', 'Eddie Coke', 'Louis Natheaux', ""Arthur O'Connell"", 'Guy Repp', 'Tom Steele', 'Richard Wilson', 'Louise Currie', 'Walter Sande', 'Jan Wiley', 'Milton Kibbee', 'Buck Mack', 'Alan Ladd', 'Thomas A. Curran', 'Jack Curtis', 'George Noisom', 'Gerald Pierce', 'Donna Dax', 'George DeNormand', 'Bud Geary', 'Bert LeBaron', 'Clyde McAtee', 'Cyril Ring', 'Roland Winters', 'Lew Harvey', 'Herman J. Mankiewicz', 'Eddie Dew', 'Perc Launders', 'John Dilson', 'Walter James', 'Robert Dudley', 'Suzanne Dulier', 'Al Eben', 'Johnny Eckert', 'Carl Ekberg', 'Edith Evanson', 'Carl Faulkner', 'Juanita Fields', 'Edna Mae Jones', 'Leda Nicova', 'Jolane Reynolds', 'Suzanne Ridgway', 'Olin Francis', 'Louise Franklin', 'Renee Godfrey', 'Peter Gowland', 'Jimmy Grant', 'Jesse Graves', 'Ernest Grooney', 'Jack Gwynne', 'Teddy Mangean', 'Henry Hebert', ""Bryan 'Slim' Hightower"", 'Mitchell Ingraham', 'Philip Morris', 'Francis Sayles', 'George W. Jimenez', 'Ellen Lowe', 'James T. Mack', 'Mickey Martin', 'Bruce Sidney', 'Major McBride', 'Frank McLure', 'Charles Meakin', 'Edward Peil Jr.', 'Irving Mitchell', 'Frances E. Neal', 'Lillian Nicholson', 'Joseph North', ""William H. O'Brien"", 'Field Norton', 'Dick Scott', ""Frank O'Connor"", 'Russ Powell', 'Bert Stevens', 'Thomas Pogue', ""Lillian O'Malley"", 'Jack Raymond', 'Gohr Van Vleck', 'Myrtle Rishell', 'Benny Rubin', 'Shimen Ruskin', 'George Sherwood', 'Edward Ryan', 'Landers Stevens', 'Harry J. Vejar', 'Tudor Williams', 'Arthur Yeoman', 'Tim Davis', 'Charles Bennett', 'Arthur Kay', 'John Alban']";['Orson Welles', 'Herman J. Mankiewicz'];['Robert Wise'];['Gregg Toland'];Newspaper magnate, Charles Foster Kane is taken from his mother as a boy and made the ward of a rich industrialist. As a result, every well-meaning, tyrannical or self-destructive move he makes for the rest of his life appears in some way to be a reaction to that deeply wounding event.
776;The Rules of the Game;10.125;7.632;1939;106;France;Français;8847685;0;['Drama', 'Comedy', 'Romance'];['Jean Renoir'];['Marcel Dalio', 'Nora Gregor', 'Paulette Dubost', 'Mila Parély', 'Odette Talazac', 'Claire Gérard', 'Anne Mayen', 'Lise Elina', 'Julien Carette', 'Roland Toutain', 'Gaston Modot', 'Jean Renoir', 'Pierre Magnier', 'Eddy Debray', 'Pierre Nay', 'Richard Francoeur', 'Léon Larive', 'Nicolas Amato', 'Henri Cartier-Bresson', 'Celestin', 'Tony Corteggiani', 'Geo Forster', 'Roger Forster', 'Camille François', 'Jenny Hélia', 'André Zwoboda', 'Jacques Beauvais', 'Maurice Marceau', 'Marguerite de Morlaye', 'Marcel Melrac', 'Antoine Corteggiani'];['Jean Renoir'];['Marthe Huguet', 'Marguerite Renoir'];['Jean Bachelet', 'Jacques Lemare', 'Jean-Paul Alphen', 'Alain Renoir'];A weekend at a marquis’ country château lays bare some ugly truths about a group of haut bourgeois acquaintances.
18148;Tokyo Story;11.172;8.257;1953;137;Japan;English;0;0;['Drama'];['Yasujirō Ozu'];['Chishū Ryū', 'Chieko Higashiyama', 'Setsuko Hara', 'Haruko Sugimura', 'Sō Yamamura', 'Kuniko Miyake', 'Kyōko Kagawa', 'Eijirō Tōno', 'Nobuo Nakamura', 'Shirō Ōsaka', 'Hisao Toake', 'Teruko Nagaoka', 'Mutsuko Sakura', 'Toyo Takahashi', 'Tōru Abe', 'Sachiko Mitani', 'Ryōko Mizuki', 'Keijirô Morozumi', 'Shozo Suzuki', 'Haruko Chichibu', 'Takashi Miki', 'Toshinosuke Nagao', 'Zen Murase', 'Mitsuhiro Môri', 'Yoshiko Togawa', 'Fumio Tooyama'];['Yasujirō Ozu', 'Kōgo Noda'];['Yoshiyasu Hamamura'];['Yûharu Atsuta'];The elderly Shukishi and his wife, Tomi, take the long journey from their small seaside village to visit their adult children in Tokyo. Their elder son, Koichi, a doctor, and their daughter, Shige, a hairdresser, don't have much time to spend with their aged parents, and so it falls to Noriko, the widow of their younger son who was killed in the war, to keep her in-laws company.
426;Vertigo;27.246;8.204;1958;128;United States of America;English;2479000;7797728;['Mystery', 'Romance', 'Thriller'];['Alfred Hitchcock'];['James Stewart', 'Kim Novak', 'Barbara Bel Geddes', 'Tom Helmore', 'Henry Jones', 'Raymond Bailey', 'Ellen Corby', 'Konstantin Shayne', 'Lee Patrick', 'Bess Flowers', 'Alfred Hitchcock', 'David Ahdar', 'Sara Taft'];['Alec Coppel', 'Samuel A. Taylor'];['George Tomasini'];['Robert Burks'];A retired San Francisco detective suffering from acrophobia investigates the strange activities of an old friend's wife, all the while becoming dangerously obsessed with her.
3114;The Searchers;21.644;7.7;1956;119;United States of America;Español;3750000;0;['Western'];['John Ford'];['John Wayne', 'Jeffrey Hunter', 'Vera Miles', 'Natalie Wood', 'Ward Bond', 'John Qualen', 'Olive Carey', 'Henry Brandon', 'Ken Curtis', 'Harry Carey, Jr.', 'Antonio Moreno', 'Hank Worden', 'Beulah Archuletta', 'Walter Coy', 'Dorothy Jordan', 'Pippa Scott', 'Patrick Wayne', 'Lana Wood', 'Mae Marsh', 'Ruth Clifford', 'Chuck Roberson', 'Chuck Hayward'];['Frank S. Nugent'];['Jack Murray'];['Winton C. Hoch'];As a Civil War veteran spends years searching for a young niece captured by Indians, his motivation becomes increasingly questionable.
643;Battleship Potemkin;16.778;7.634;1925;75;Soviet Union;No Language;0;45100;['Drama', 'History'];['Sergei Eisenstein'];['Aleksandr Antonov', 'Vladimir Barsky', 'Grigori Aleksandrov', 'Ivan Bobrov', 'Mikhail Gomorov', 'Aleksandr Levshin', 'N. Poltavtseva', 'Konstantin Feldman', 'Prokhorenko', 'A. Glauberman', 'Beatrice Vitoldi', 'Danylo Antonovych', 'Iona Biy-Brodskiy', 'Julia Eisenstein', 'Sergei Eisenstein', 'Andrey Fayt', 'Yuriy Korobeynikov (I)', 'Marusov', 'Protopopov', 'Repnikova', 'Vladimir Uralsky', 'Zerenin', 'Aleksanteri Ahola-Valo'];[];['Sergei Eisenstein', 'Grigori Aleksandrov'];['Eduard Tisse'];A dramatized account of a great Russian naval mutiny and a resultant public demonstration, showing support, which brought on a police massacre. The film had an incredible impact on the development of cinema and is a masterful example of montage editing.
43904;L'Atalante;11.081;7.526;1934;89;France;Français;0;0;['Romance', 'Drama', 'Comedy'];['Jean Vigo'];['Michel Simon', 'Dita Parlo', 'Jean Dasté', 'Gilles Margaritis', 'Louis Lefebvre', 'Maurice Gilles', 'Raphaël Diligent', 'Claude Aveline', 'René Blech', 'Lou Bonin', 'Fanny Clar', 'Charles Dorat', 'Genya Lozinska', 'Gen Paul', 'Jacques Prévert', 'Pierre Prévert', 'Albert Riéra', 'Jacques Brunius', 'Paul Grimault'];['Jean Vigo', 'Jean Guinée', 'Albert Riéra'];['Louis Chavance'];['Boris Kaufman', 'Jean-Paul Alphen', 'Louis Berger'];Capricious small-town girl Juliette and barge captain Jean marry after a whirlwind courtship, and she comes to live aboard his boat, L'Atalante. As they make their way down the Seine, Jean grows weary of Juliette's flirtations with his all-male crew, and Juliette longs to escape the monotony of the boat and experience the excitement of a big city. When she steals away to Paris by herself, her husband begins to think their marriage was a mistake.
5801;Pather Panchali;9.86;8.066;1955;125;India;বাংলা;0;536364;['Drama'];['Satyajit Ray'];['Subir Banerjee', 'Uma Das Gupta', 'Karuna Banerjee', 'Kanu Bannerjee', 'Chunibala Devi', 'Runki Banerjee', 'Reba Devi', 'Aparna Devi', 'Tulsi Chakraborty', 'Haren Banerjee', 'Rampada Das', 'Nibhanani Devi', 'Rama Gangopadhaya', 'Roma Ganguli', 'Binoy Mukherjee', 'Haridhan Nag', 'Harimohan Nag', 'Kshirod Roy', 'Suren Roy'];['Satyajit Ray'];['Dulal Dutta'];['Subrata Mitra'];Impoverished priest Harihar Ray, dreaming of a better life for himself and his family, leaves his rural Bengal village in search of work.
780;The Passion of Joan of Arc;12.412;8.085;1928;82;France;No Language;0;0;['Drama', 'History'];['Carl Theodor Dreyer'];"['Maria Falconetti', 'Eugène Silvain', 'André Berley', 'Maurice Schutz', 'Antonin Artaud', 'Michel Simon', ""Jean d'Yd"", 'Louis Ravet', 'Armand Lurville', 'Jacques Arnna', 'Alexandre Mihalesco', 'Léon Larive', 'Jean Aymé', 'Gilbert Dacheux', 'Gilbert Dalleu', 'Paul Delauzac', 'Dimitri Dimitriev', 'Fournez-Goffard', 'Henri Gaultier', 'Paul Jorge', 'Marie Lacroix', 'Henri Maillard', 'Raymond Narlay']";['Carl Theodor Dreyer'];['Carl Theodor Dreyer', 'Marguerite Beaugé'];['Rudolph Maté'];A classic of the silent age, this film tells the story of the doomed but ultimately canonized 15th-century teenage warrior. On trial for claiming she'd spoken to God, Jeanne d'Arc is subjected to inhumane treatment and scare tactics at the hands of church court officials. Initially bullied into changing her story, Jeanne eventually opts for what she sees as the truth. Her punishment, a famously brutal execution, earns her perpetual martyrdom.
62;2001: A Space Odyssey;39.611;8.079;1968;149;United Kingdom;English;12000000;71923560;['Science Fiction', 'Mystery', 'Adventure'];['Stanley Kubrick'];"['Keir Dullea', 'Gary Lockwood', 'William Sylvester', 'Douglas Rain', 'Daniel Richter', 'Leonard Rossiter', 'Margaret Tyzack', 'Robert Beatty', 'Sean Sullivan', 'Frank Miller', 'Ed Bishop', 'Edwina Carroll', 'Heather Downham', 'Penny Brahms', ""Maggie d'Abo"", 'Chela Matthison', 'Judy Kiern', 'Alan Gifford', 'Ann Gillis', 'Vivian Kubrick', 'Kenneth Kendall', 'Kevin Scott', 'Martin Amor', 'Bill Weston', 'Glenn Beck', 'Mike Lovell', 'John Ashley', 'Jimmy Bell', 'David Charkham', 'Simon Davis', 'Jonathan Daw', 'Péter Delmár', 'Terry Duggan', 'David Fleetwood', 'Danny Grover', 'Brian Hawley', 'David Hines', 'Tony Jackson', 'John Jordan', 'Scott MacKee', 'Laurence Marchant', 'Darryl Paes', 'Joe Refalo', 'Andy Wallace', 'Bob Wilyman', 'Richard Woods', 'S. Newton Anderson', 'Sheraton Blount', 'Ann Bormann', 'Julie Croft', 'Penny Francis', 'Marcella Markham', 'Irena Marr', 'Krystyna Marr', 'Kim Neil', 'Jane Pearl', 'Penny Pearl', 'Burnell Tucker', 'John Swindells', 'John Clifford']";['Stanley Kubrick', 'Arthur C. Clarke'];['Ray Lovejoy'];['Geoffrey Unsworth'];Humanity finds a mysterious object buried beneath the lunar surface and sets off to find its origins with the help of HAL 9000, the world's most advanced super computer.
422;8½;14.275;8.221;1963;139;Italy;Deutsch;0;0;['Fantasy', 'Drama'];['Federico Fellini'];['Marcello Mastroianni', 'Claudia Cardinale', 'Anouk Aimée', 'Sandra Milo', 'Rossella Falk', 'Barbara Steele', 'Madeleine Lebeau', 'Caterina Boratto', 'Eddra Gale', 'Guido Alberti', 'Mario Conocchia', 'Bruno Agostini', 'Cesarino Miceli Picardi', 'Jean Rougeul', 'Mario Pisu', 'Yvonne Casadei', 'Ian Dallas', 'Mino Doro', 'Nadia Sanders', 'Georgia Simmons', 'Edy Vessel', 'Tito Masini', 'Annie Gorassini', 'Rossella Como', 'Mark Herron', 'Marisa Colomber', 'Neil Robinson', 'Elisabetta Catalano', 'Eugene Walter', 'Hazel Rogers', 'Gilda Dahlberg', 'Mario Tarchetti', 'Mary Indovino', 'Frazier Rippy', 'Francesco Rigamonti', 'Giulio Paradisi', 'Marco Gemini', 'Giuditta Rissone', 'Annibale Ninchi', 'Dina De Santis', 'Eva Gioia', 'Maria Tedeschi', 'Antonio Acqua', 'Giulio Calì', 'Franco Caracciolo', 'Olimpia Cavalli', 'Sonia Gessner', 'Mathilda Calnan'];['Federico Fellini', 'Tullio Pinelli', 'Ennio Flaiano', 'Brunello Rondi'];['Leo Catozzo'];['Gianni Di Venanzo'];Guido Anselmi, a film director, finds himself creatively barren at the peak of his career. Urged by his doctors to rest, Anselmi heads for a luxurious resort, but a sorry group gathers—his producer, staff, actors, wife, mistress, and relatives—each one begging him to get on with the show. In retreat from their dependency, he fantasizes about past women and dreams of his childhood.
5156;Bicycle Thieves;17.291;8.233;1948;89;Italy;Italiano;133000;436655;['Drama'];['Vittorio De Sica'];['Lamberto Maggiorani', 'Enzo Staiola', 'Lianella Carell', 'Elena Altieri', 'Gino Saltamerenda', 'Giulio Chiari', 'Vittorio Antonucci', 'Michele Sakara', 'Carlo Jachino', 'Emma Druetti', 'Giulio Battiferri', 'Sergio Leone', 'Mario Meniconi', 'Checco Rissone', 'Peppino Spadaro', 'Nando Bruno', 'Eolo Capritti', 'Memmo Carotenuto', 'Umberto Spadaro', 'Fausto Guerzoni', 'Piero Heliczer', 'Massimo Randisi'];"['Vittorio De Sica', 'Cesare Zavattini', ""Suso Cecchi d'Amico"", 'Oreste Biancoli', 'Adolfo Franci', 'Gerardo Guerrieri', 'Gherardo Gherardi']";['Eraldo Da Roma'];['Carlo Montuori'];A working man's livelihood is threatened when someone steals his bicycle.
872;Singin' in the Rain;20.46;8.167;1952;103;United States of America;English;2540800;7200000;['Comedy', 'Music', 'Romance', 'Drama'];['Stanley Donen', 'Gene Kelly'];"['Gene Kelly', ""Donald O'Connor"", 'Debbie Reynolds', 'Jean Hagen', 'Millard Mitchell', 'Cyd Charisse', 'Douglas Fowley', 'Rita Moreno', 'Mae Clarke', 'Bess Flowers', 'Robert Foulk', 'Kathleen Freeman', 'Joi Lansing', 'Sylvia Lewis', ""Harry 'Snub' Pollard"", 'William Schallert', 'Elaine Stewart', 'Brick Sullivan', 'John George', 'King Donovan', 'Lana Turner', 'Allen Sutherland', 'Dawn Addams', 'John Albright', 'Betty Van Allen', 'Sue Allen', 'Marie Ardell', 'Bette Arlen', 'David Bair', 'Jimmy Bates', 'Mary Bayless', 'Marcella Becker', 'Margaret Bert', 'Madge Blake', 'Lulu Mae Bohrman', 'Gail Bonney', 'Chet Brandenburg', 'Tex Brodus', 'Barbara Carroll', 'Gwen Carter', 'Bill Chatham', 'Lyle Clark', 'Dorinda Clifton', 'Harry Cody', 'Chick Collins', 'Pat Conway', 'Jeanne Coyne', 'Ruby C. Currie', 'Fred Datig Jr.', 'Bert Davidson', 'Robert Dayo', 'Gloria Dea', 'Patricia Denise', 'Harry Denny', 'Kay Deslys', 'John Dodsworth', 'Michael Dugan', 'Phil Dunham', 'Helen Eby-Rock', 'Richard Emory', 'Betty Erbes', 'Charles Evans', 'Tommy Farrell', 'Ernie Flatt', 'George Ford', 'Robert Fortier', 'Dan Foster', 'Clair Freeman', 'Lance Fuller', 'Doris Fulton', 'Jeanne Gail', 'Glen Gallagher', 'Jon Gardner', 'Diane Garrett', 'Jack George', 'Kenneth Gibson', 'Mickey Golden', 'Inez Gorman', 'A. Cameron Grant', 'Beatrice Gray', 'Marion Gray', 'Robert Haines', 'William Hamel', 'Betty Hannon', 'Sam Harris', 'Jean Harrison', 'Timmy Hawkins', 'Jack Hendricks', 'Lars Hensen', 'Jean Heremans', 'Stuart Holmes', 'Don Hulbert', 'Frank Hyers', 'Patricia Jackson', 'Ivor James', 'Morgan Jones', 'David Kasday', 'Jan Kayne', 'Jimmy Kelly', 'Kenner G. Kemp', 'Mike Lally', 'Judy Landon', 'Joi Lansing', 'Janet Lavis', 'Virginia Lee', 'Meredith Leeds', 'William F. Leicester', 'Peggy Leon', 'Diki Lerner', 'Bill Lewin', 'King Lockwood', 'Leon Lontoc', 'Leota Lorraine', 'Paul Maxey', 'Dorothy McCarty', 'Ann McCrea', 'Philo McCullough', 'Ray McDonald', 'Johnny McGovern', 'Joseph Mell', 'Carl Milletaire', 'Gloria Moore', 'Forbes Murray', 'Peggy Murray', 'Anne Neyland', 'Ruth Packard', 'Dorothy Patrick', 'Allen Pinson', 'Angi O. Poulos', 'George Reeder', 'Charles Regan', 'Shirley Jean Rickert', 'Joanne Rio', 'Tony Rocket', 'Victor Romito', 'Dennis Ross', 'Paul Salata', 'Cosmo Sardo', 'Phil Schumacher', 'Betty Scott', 'David Sharpe', 'Julius Tannen', 'Harry Tenbrook', 'Beverly Thomas', 'Beverly Thompson', 'Jimmy Thompson', 'Dee Turnell', 'Dorothy Tuttle', 'Tyra Vaughn', 'Pat Walker', 'Tommy Walker', 'Bobby Watson', 'Chalky Williams', 'Robert B. Williams', 'Wilson Wood', 'Adam York', 'Norma Zimmer']";['Adolph Green', 'Betty Comden'];['Adrienne Fazan'];['Harold Rosson'];In 1927 Hollywood, a silent film production company and cast make a difficult transition to sound.
631;Sunrise: A Song of Two Humans;9.884;7.884;1927;94;United States of America;No Language;0;0;['Drama', 'Romance'];['F. W. Murnau'];['George O’Brien', 'Janet Gaynor', 'Margaret Livingston', 'Bodil Rosing', 'J. Farrell MacDonald', 'Ralph Sipperly', 'Jane Winton', 'Arthur Housman', 'Eddie Boland', 'Herman Bing', 'Sidney Bracey', 'Gino Corrado', 'Vondell Darr', 'Sally Eilers', 'Gibson Gowland', 'Thomas Jefferson', 'Bob Kortman', 'F. W. Murnau', 'Barry Norton', 'Robert Parrish', 'Sally Phipps', 'Harry Semels', 'Phillips Smalley', 'Leo White', 'Clarence Wilson'];['Carl Mayer'];['Harold D. Schuster'];['Charles Rosher', 'Karl Struss'];A married farmer falls under the spell of a slatternly woman from the city, who tries to convince him to drown his wife.
901;City Lights;16.063;8.341;1931;87;United States of America;No Language;1500000;4250000;['Comedy', 'Drama', 'Romance'];['Charlie Chaplin'];['Charlie Chaplin', 'Virginia Cherrill', 'Harry Myers', 'Al Ernest Garcia', 'Hank Mann', 'Albert Austin', 'Eddie Baker', 'Henry Bergman', 'Buster Brodie', 'Jeanne Carpenter', 'Tom Dempsey', 'James Donnelly', 'Ray Erlenborn', 'Robert Graves', 'Charles Hammond', 'Joseph Herrick', 'Austen Jewell', 'Willie Keeler', 'Robert Parrish', 'John Rand', 'W.C. Robinson', 'Cy Slocum', 'Tony Stabenau', 'Mark Strong', 'Tiny Ward', 'Stanhope Wheatcroft', 'Florence Wix', 'Granville Redmond', 'Florence Lee', 'Jean Harlow'];['Charlie Chaplin', 'Harry Crocker', 'Harry Clive'];['Charlie Chaplin', 'Willard Nico'];['Gordon Pollock', 'Roland Totheroh'];In this sound-era silent film, a tramp falls in love with a beautiful blind flower seller.
5165;L'Avventura;7.74;7.6;1960;144;Italy;Italiano;0;0;['Drama', 'Mystery'];['Michelangelo Antonioni'];"['Gabriele Ferzetti', 'Monica Vitti', 'Lea Massari', 'Dominique Blanchar', 'Renzo Ricci', 'James Addams', 'Dorothy De Poliolo', 'Lelio Luttazzi', 'Giovanni Petrucci', 'Esmeralda Ruspoli', 'Enrico Bologna', 'Franco Cimino', 'Giovanni Danesi', 'Rita Mole', 'Renato Pinciroli', 'Angela Tommasi Di Lampedusa', 'Vincenzo Tranchina', 'Valeria Perri', 'Prof. Cucco', ""Jack O'Connell""]";['Michelangelo Antonioni', 'Tonino Guerra', 'Elio Bartolini'];['Eraldo Da Roma'];['Aldo Scavarda'];Claudia and Anna join Anna's lover, Sandro, on a boat trip to a remote volcanic island. When Anna goes missing, a search is launched. In the meantime, Sandro and Claudia become involved in a romance despite Anna's disappearance, though the relationship suffers from guilt and tension.
346;Seven Samurai;25.425;8.451;1954;207;Japan;日本語;2000000;346300;['Action', 'Drama'];['Akira Kurosawa'];['Toshirō Mifune', 'Takashi Shimura', 'Yoshio Inaba', 'Seiji Miyaguchi', 'Minoru Chiaki', 'Daisuke Katō', 'Isao Kimura', 'Keiko Tsushima', 'Yukiko Shimazaki', 'Kamatari Fujiwara', 'Yoshio Kosugi', 'Bokuzen Hidari', 'Yoshio Tsuchiya', 'Kokuten Kōdō', 'Eijirō Tōno', 'Jun Tatara', 'Atsushi Watanabe', 'Toranosuke Ogawa', 'Isao Yamagata', 'Kichijirô Ueda', 'Sôjin Kamiyama', 'Gen Shimizu', 'Keiji Sakakida', 'Shinpei Takagi', 'Shin Ôtomo', 'Toshio Takahara', 'Hiroshi Sugi', 'Hiroshi Hayashi', 'Sachio Sakai', 'Sôkichi Maki', 'Ichirô Chiba', 'Noriko Sengoku', 'Noriko Honma', 'Masanobu Ôkubo', 'Etsuo Saijo', 'Minoru Itô', 'Haruya Sakamoto', 'Gorô Sakurai', 'Hideo Shibuya', 'Kiyoshi Kamoda', 'Senkichi Ômura', 'Takashi Narita', 'Shôichi Hirose', 'Kôji Uno', 'Masaaki Tachibana', 'Kamayuki Tsubono', 'Taiji Naka', 'Chindanji Miyagawa', 'Shigemi Sunagawa', 'Akira Tani', 'Akio Kusama', 'Ryûtarô Amami', 'Jun Mikami', 'Haruo Nakajima', 'Sanpei Mine', 'Masahide Matsushita', 'Kaneo Ikeda', 'Takuzô Kumagaya', 'Ippei Kawagoe', 'Jirô Suzukawa', 'Junpei Natsuki', 'Kyôichi Kamiyama', 'Haruo Suzuki', 'Gorô Amano', 'Akira Kitchôji', 'Kōji Iwamoto', 'Hiroshi Akitsu', 'Akira Yamada', 'Kazuo Imai', 'Eisuke Nakanishi', 'Toku Ihara', 'Hideo Ôtsuka', 'Shû Ôe', 'Yasuhisa Tsutsumi', 'Yasumasa Ônishi', 'Tsuneo Katagiri', 'Megeru Shimoda', 'Masayoshi Kawabe', 'Shigeo Katô', 'Yoshikazu Kawamata', 'Takeshi Seki', 'Haruko Toyama', 'Tsuruko Mano', 'Matsue Ono', 'Tsurue Ichimanji', 'Masako Ôshiro', 'Kyôko Ozawa', 'Michiko Kadono', 'Toshiko Nakano', 'Shizuko Azuma', 'Michiko Kawabe', 'Yûko Togawa', 'Yayoko Kitano', 'Kyoko Mori', 'Misao Suyama', 'Toriko Takahara', 'Takeshi Katō', 'Tatsuya Nakadai', 'Ken Utsui', 'Ren Yamamoto'];['Akira Kurosawa', 'Shinobu Hashimoto', 'Hideo Oguni'];['Akira Kurosawa'];['Asakazu Nakai'];A samurai answers a village's request for protection after he falls on hard times. The town needs protection from bandits, so the samurai gathers six others to help him teach the people how to defend themselves, and the villagers provide the soldiers with food.
961;The General;12.277;8.0;1926;79;United States of America;No Language;750000;1000000;['Action', 'Adventure', 'Comedy', 'Drama', 'War'];['Buster Keaton', 'Clyde Bruckman'];['Buster Keaton', 'Marion Mack', 'Glen Cavender', 'Jim Farley', 'Frederick Vroom', 'Charles Henry Smith', 'Joe Keaton', 'Al St. John', 'Frank Barnes', 'Mike Donlin', 'Tom Nawn', 'Jimmy Bryant', 'Budd Fine', 'Ray Hanford', 'Charles Phillips', 'Eddie Foster', 'Frank Hagney', 'Jack Hanlon', 'Edward Hearn', 'Hilliard Karr', 'Louis Lewyn', 'Elgin Lessley'];['Buster Keaton', 'Clyde Bruckman'];['Buster Keaton', 'Sherman Kell'];['Bert Haines', 'Devereaux Jennings'];During America’s Civil War, Union spies steal engineer Johnnie Gray's beloved locomotive, 'The General'—with Johnnie's lady love aboard an attached boxcar—and he single-handedly must do all in his power to both get The General back and to rescue Annabelle.
269;Breathless;13.409;7.62;1960;90;France;Français;0;0;['Drama', 'Crime'];['Jean-Luc Godard'];['Jean-Paul Belmondo', 'Jean Seberg', 'Daniel Boulanger', 'Jean-Pierre Melville', 'Henri-Jacques Huet', 'Van Doude', 'Claude Mansard', 'Jean-Luc Godard', 'Richard Balducci', 'Roger Hanin', 'Liliane Dreyfus', 'Michel Fabre', 'André S. Labarthe', 'François Moreuil', 'Liliane Robin', 'José Bénazéraf', 'Jean Domarchi', 'Jean Douchet', 'Gérard Brach', 'Philippe de Broca', 'Raymond Huntley', 'Michel Mourlet', 'Louiguy', 'Guido Orlando', 'Madame Paul', 'Jacques Serguine', 'Virginie Ullmann', 'Emile Villion'];['Jean-Luc Godard'];['Cécile Decugis'];['Raoul Coutard'];A small-time thief steals a car and impulsively murders a motorcycle policeman. Wanted by the authorities, he attempts to persuade a girl to run away to Italy with him.
895;Andrei Rublev;12.68;8.1;1966;183;Soviet Union;;0;0;['Drama', 'History'];['Andrei Tarkovsky'];['Anatoliy Solonitsyn', 'Ivan Lapikov', 'Nikolay Grinko', 'Nikolai Sergeyev', 'Irma Raush', 'Nikolay Burlyaev', 'Yuriy Nazarov', 'Yuriy Nikulin', 'Rolan Bykov', 'Nikolay Grabbe', 'Mikhail Kononov', 'Stepan Krylov', 'Bolot Beyshenaliev', 'B. Matysik', 'Anatoliy Obukhov', 'Volodya Titov', 'Nikolay Glazkov', 'K. Aleksandrov', 'Semyon Bardin', 'Ivan Bykov', 'G. Borisovskiy', 'Vladimir Vasilyev', 'Zinaida Vorkul', 'Aleksandr Titov', 'Viktor Volkov', 'Irina Miroshnichenko', 'Tamara Ogorodnikova', 'Natalya Radolitskaya', 'Nikolay Kutuzov', 'Dmitriy Orlovskiy', 'Vladimir Guskov', 'Igor Donskoy', 'Iskender Ryskulov', 'P. Makarov', 'Georgiy Sochevko', 'Nelli Snegina', 'G. Pokorskiy', 'Asanbek Umuraliev', 'Vyacheslav Tsaryov', 'Ivan Turchenkov', 'Anatoliy Nikitin', 'P. Yermakov', 'Aleksandr Petrov', 'Nikolay Sibeikin', 'Vasiliy Tsygankov', 'Larisa Solonitsyna'];[];['Lyudmila Feiginova', 'Olga Shevkunenko', 'Tatyana Egorycheva'];['Vadim Yusov'];An expansive Russian drama, this film focuses on the life of revered religious icon painter Andrei Rublev. Drifting from place to place in a tumultuous era, the peace-seeking monk eventually gains a reputation for his art. But after Rublev witnesses a brutal battle and unintentionally becomes involved, he takes a vow of silence and spends time away from his work. As he begins to ease his troubled soul, he takes steps towards becoming a painter once again.
48684;Intolerance;0.867;5.7;2000;11;United Kingdom;English;0;0;['Comedy', 'Science Fiction', 'Animation'];['Phil Mulloy'];[];[];[];[];The film begins with an Earth space craft stumbling upon a movie floating in the vast nothingness. The film turns out to be from planet Zog and when people see it, they are shocked and angered by the Zogs (or is it 'Zogians' or 'Zogites'?). It seems that they have their genitals where our heads are and vice-versa. To make things really weird, they eat and drink with their genitals and defecate with their faces.
946;Letter from an Unknown Woman;8.696;7.863;1948;87;United States of America;English;0;0;['Drama', 'Romance'];['Max Ophüls'];['Joan Fontaine', 'Louis Jourdan', 'Mady Christians', 'Marcel Journet', 'Art Smith', 'Carol Yorke', 'Howard Freeman', 'John Good', 'Leo B. Pessin', 'Erskine Sanford', 'Otto Waldis', 'Sonja Bryden', 'Patricia Alphin', 'Harry Anderson', 'Edit Angold', 'Betty Blythe', 'Gabrielle Windsor', 'June Wood', 'Judith Woodbury', 'Mary Worth', 'Jack Worth'];['Howard Koch'];['Ted J. Kent'];['Franz Planer'];A pianist about to flee from a duel receives a letter from a woman he cannot remember. As she tells the story of her lifelong love for him, he is forced to reinterpret his own past.
