Id_peli;Titulo;Popularidad;Rating;Fecha;Duracion;Pais;Idioma;Presupuesto;Ganancia;Generos;Director;Casting;Guion;Montaje;DOP;Resumen
10403;The Player;10.012;7.214;1992;124;United States of America;English;8000000;21706101;['Comedy', 'Crime', 'Drama', 'Mystery'];['Robert Altman'];"['Tim Robbins', 'Greta Scacchi', 'Fred Ward', 'Whoopi Goldberg', 'Peter Gallagher', 'Brion James', 'Cynthia Stevenson', ""Vincent D'Onofrio"", 'Dean Stockwell', 'Richard E. Grant', 'Sydney Pollack', 'Lyle Lovett', 'Dina Merrill', 'Angela Hall', 'Leah Ayres', 'Paul Hewitt', 'Randall Batinkoff', 'Jeremy Piven', 'Gina Gershon', 'Frank Barhydt', 'Mike Kaplan', 'Kevin Scannell', 'Margery Bond', 'Susan Emshwiller', 'Brian Brophy', 'Michael Tolkin', 'Stephen Tolkin', 'Natalie Strong', 'Peter Koch', 'Pamela Bowen', 'Jeff Celentano', 'Steve Allen', 'Richard Anderson', 'René Auberjonois', 'Harry Belafonte', 'Shari Belafonte', 'Karen Black', 'Michael Bowen', 'Gary Busey', 'Robert Carradine', 'Charles Champlin', 'Cher', 'James Coburn', 'Cathy Lee Crosby', 'John Cusack', 'Brad Davis', 'Paul Dooley', 'Thereza Ellis', 'Peter Falk', 'Felicia Farr', 'Katarzyna Figura', 'Louise Fletcher', 'Dennis Franz', 'Teri Garr', 'Leeza Gibbons', 'Scott Glenn', 'Jeff Goldblum', 'Elliott Gould', 'Joel Grey', 'David Alan Grier', 'Buck Henry', 'Anjelica Huston', 'Kathy Ireland', 'Steve James', 'Maxine John-James', 'Sally Kellerman', 'Sally Kirkland', 'Jack Lemmon', 'Marlee Matlin', 'Andie MacDowell', 'Malcolm McDowell', 'Jayne Meadows', 'Martin Mull', 'Jennifer Nash', 'Nick Nolte', 'Alexandra Powers', 'Bert Remsen', 'Guy Remsen', 'Patricia Resnick', 'Burt Reynolds', 'Jack Riley', 'Julia Roberts', 'Mimi Rogers', 'Annie Ross', 'Alan Rudolph', 'Jill St. John', 'Susan Sarandon', 'Adam Simon', 'Rod Steiger', 'Joan Tewkesbury', 'Brian Tochi', 'Lily Tomlin', 'Robert Wagner', 'Ray Walston', 'Bruce Willis', 'Marvin Young', 'Ned Bellamy', 'Steve Fuji', 'Althea Gibson', 'Ted Hartley', 'Jack Jason', 'Jack Kney', 'James McLindon', 'Ritchie Montgomery', 'Derek Raser', 'Scott Shaw', 'Patrick Swayze', 'Dan Twyman', 'Marina Zenovich']";['Michael Tolkin'];['Geraldine Peroni', 'Maysie Hoy'];['Jean Lépine'];A Hollywood studio executive is being sent death threats by a writer whose script he rejected - but which one?
31416;The Wind;5.777;7.4;1928;76;United States of America;No Language;0;0;['Drama', 'Romance', 'Western'];['Victor Sjöström'];['Lillian Gish', 'Lars Hanson', 'Montagu Love', 'Dorothy Cumming', 'Edward Earle', 'William Orlamond', 'Carmencita Johnson', 'Leon Janney', 'Billy Kent Schaefer', 'Sam Appel', 'Si Jenks', 'Cullen Johnson', 'Seessel Anne Johnson', 'Gus Leonard', 'Margaret Mann'];['Frances Marion'];['Conrad A. Nervig'];['John Arnold'];When Letty Mason relocates to West Texas, she finds herself unsettled by the ever-present wind and sand. Arriving at her new home at the ranch of her cousin, Beverly, she receives a surprisingly cold welcome from his wife, Cora. Soon tensions in the family and unwanted attention from a trio of suitors, including neighbor Lige Hightower, leave Letty increasingly disturbed, resulting in tragedy.
43878;A Day in the Country;7.41;7.373;1946;41;France;Français;0;0;['Drama', 'Romance', 'Comedy'];['Jean Renoir'];"['Sylvia Bataille', 'Jane Marken', ""Georges D'Arnoux"", 'Jacques Brunius', 'André Gabriello', 'Paul Temps', 'Gabrielle Fontan', 'Jean Renoir', 'Marguerite Renoir', 'Jacques Becker', 'Pierre Lestringuez', 'Georges Bataille', 'Henri Cartier-Bresson', 'Alain Renoir']";[];['Marguerite Renoir', 'Marinette Cadix'];['Claude Renoir'];The family of a Parisian shop-owner spends a day in the country. The daughter falls in love with a man at the inn, where they spend the day.
62637;Why Has Bodhi-Dharma Left for the East?;2.209;7.3;1989;144;South Korea;한국어/조선말;0;0;['Drama'];['Bae Yong-kyun'];['Lee Pan-yong', 'Sin Won-sop', 'Hwang Hae-jin', 'Go Su-myeong', 'Yun Byeong-hui', 'Choi Myeong-deok', 'Kim Hui-ryong', 'Lee Eun-Young', 'Lee Seon-hye'];[];['Bae Yong-kyun'];['Bae Yong-kyun'];"Three people live in a remote Buddhist monastery near Mount Chonan: Hyegok, the old master; Yong Nan, a young man who has left his extended family in the city to seek enlightenment - Hyegok calls him Kibong!; and, an orphan lad Haejin, whom Hyegok has brought to the monastery to raise as a monk. The story is mostly Yong Nan's, told in flashbacks: how he came to the monastery, his brief return to the city, his vacillation between the turbulence of the world and his hope to overcome passions and escape the idea of self. We also see Hyegok as a teacher, a protector, and a father figure, and we watch Haejin make his way as a curious and nearly self-sufficient child."
132392;A Diary for Timothy;1.853;6.6;1945;38;United Kingdom;English;0;0;['Documentary'];['Humphrey Jennings'];['Michael Redgrave', 'Myra Hess', 'John Gielgud'];[];['Alan Osbiston', 'Stewart McAllister'];['Fred Gamage'];"This brief documentary-style film presents the status of Great Britain near the end of the Second World War by means of a visual diary for a baby boy born in September, 1944. Narration explains to ""Timothy"" what his family, his neighbors, and his fellow citizens are going through as the war nears its end, and what problems may remain for new Englishmen like Timothy to solve."
28162;A Matter of Life and Death;11.526;7.8;1946;104;United Kingdom;English;0;0;['Comedy', 'Fantasy', 'Romance', 'Drama'];['Emeric Pressburger', 'Michael Powell'];['David Niven', 'Kim Hunter', 'Marius Goring', 'Kathleen Byron', 'Richard Attenborough', 'Robert Coote', 'Bonar Colleano', 'Joan Maude', 'Roger Livesey', 'Robert Atkins', 'Edwin Max', 'Betty Potter', 'Abraham Sofaer', 'Raymond Massey', 'Lois Maxwell'];['Emeric Pressburger', 'Michael Powell'];['Reginald Mills'];['Jack Cardiff'];When a young RAF pilot miraculously survives bailing out of his aeroplane without a parachute, he falls in love with an American radio operator. But the officials in the other world realise their mistake and dispatch an angel to collect him.
28974;A Woman of Paris: A Drama of Fate;6.28;6.9;1923;78;United States of America;No Language;0;0;['Drama', 'Romance'];['Charlie Chaplin'];['Edna Purviance', 'Clarence Geldart', 'Carl Miller', 'Lydia Knott', 'Charles K. French', 'Adolphe Menjou', 'Betty Morrissey', 'Malvina Polo', 'Charlie Chaplin', 'Bess Flowers', 'Henry Bergman'];[];['Charlie Chaplin', 'Monta Bell'];['Roland Totheroh', 'Jack Wilson'];When Marie St. Clair believes she has been jilted by her artist fiance Jean, she decides to leave for Paris on her own. After spending a year in the city as a mistress of the wealthy Pierre Revel, she is reunited with Jean by chance. This leaves her with the choice between a glamorous life in Paris, and the true love she left behind.
2000;Aguirre, the Wrath of God;10.151;7.5;1972;95;Germany;Deutsch;370000;37041;['Adventure', 'Drama', 'History'];['Werner Herzog'];['Klaus Kinski', 'Helena Rojo', 'Del Negro', 'Ruy Guerra', 'Peter Berling', 'Cecilia Rivera', 'Daniel Ades', 'Edward Roland', 'Alexandra Cheves', 'Armando Polanah', 'Daniel Farfán', 'Julio E. Martínez', 'Alejandro Repullés', 'Claus Biederstaedt', 'Lothar Blumhagen', 'Heinz Theo Branding', 'Christian Brückner', 'Michael Chevalier', 'Norbert Gescher', 'Justo González', 'Uta Hallant', 'Manfred Lehmann', 'Antonio Marquez', 'Gerd Martienzen', 'Edgar Ott', 'Uwe Paulsen', 'Dieter Ranspach'];[];['Beate Mainka-Jellinghaus'];['Thomas Mauch'];A few decades after the destruction of the Inca Empire, a Spanish expedition led by the infamous Aguirre leaves the mountains of Peru and goes down the Amazon River in search of the lost city of El Dorado. When great difficulties arise, Aguirre’s men start to wonder whether their quest will lead them to prosperity or certain death.
10235;Alexander Nevsky;8.618;7.138;1938;109;Soviet Union;Pусский;0;0;['Drama', 'History', 'War'];['Sergei Eisenstein', 'Dmitriy Vasilev'];['Nikolai Cherkasov', 'Nikolai Okhlopkov', 'Andrei Abrikosov', 'Valentina Ivashyova', 'Lev Fenin', 'Sergei Blinnikov', 'Nikolai Arsky', 'Varvara Massalitinova'];[];['Sergei Eisenstein'];['Eduard Tisse'];When German knights invade Russia, Prince Alexander Nevsky must rally his people to resist the formidable force. After the Teutonic soldiers take over an eastern Russian city, Alexander stages his stand at Novgorod, where a major battle is fought on the ice of frozen Lake Chudskoe. While Alexander leads his outnumbered troops, two of their number, Vasili and Gavrilo, begin a contest of bravery to win the hand of a local maiden.
279;Amadeus;23.867;8.033;1984;160;United States of America;Deutsch;18000000;51973029;['History', 'Music', 'Drama'];['Miloš Forman'];['F. Murray Abraham', 'Tom Hulce', 'Elizabeth Berridge', 'Roy Dotrice', 'Simon Callow', 'Christine Ebersole', 'Jeffrey Jones', 'Barbara Bryne', 'Cynthia Nixon', 'Douglas Seale', 'Charles Kay', 'Kenny Baker', 'Martin Cavina', 'Roderick Cook', 'Milan Demjanenko', 'Peter DiGesu', 'Patrick Hines', 'Nicholas Kepros', 'Philip Lenkowsky', 'Lisbeth Bartlett', 'Richard Frank', 'Herman Meckler', 'Jonathan Moore', 'Brian Pettifer', 'Vincent Schiavelli', 'John Strauss', 'Karl-Heinz Teuber', 'Miro Grisa', 'Karel Gult', 'Ladislav Krečmer', 'Karel Fiala', 'John Carrafa', 'Hana Brejchová', 'Miriam Chytilová', 'Karel Effa', 'René Gabzdyl', 'Karel Hábl', 'Jiří Krytinář', 'Jan Kuželka', 'Jiří Lír', 'Jitka Molavcová', 'Pavel Nový', 'Jan Pohan', 'Tereza Pokorná-Herzová', 'Ivan Pokorný', 'Milan Riehs', 'Dana Vávrová', 'June Anderson', 'Isobel Buchanan', 'Anne Howells', 'Robin Leggate', 'Felicity Lott', 'Alexander Oliver', 'Samuel Ramey', 'Richard Stilwell', 'John Tomlinson', 'Willard White', 'Michele Esposito', 'Zdeněk Mahler', 'Vladimír Svitáček', 'Jana Musilová', 'Kenneth McMillan', 'Cassie Stuart', 'Rita Zohar'];['Peter Shaffer'];['Michael Chandler', 'Nena Danevic'];['Miroslav Ondříček'];Wolfgang Amadeus Mozart is a remarkably talented young Viennese composer who unwittingly finds a fierce rival in the disciplined and determined Antonio Salieri. Resenting Mozart for both his hedonistic lifestyle and his undeniable talent, the highly religious Salieri is gradually consumed by his jealousy and becomes obsessed with Mozart's downfall, leading to a devious scheme that has dire consequences for both men.
5055;Ashes and Diamonds;8.224;7.455;1958;103;Poland;Polski;0;0;['Drama', 'Romance', 'War'];['Andrzej Wajda'];['Zbigniew Cybulski', 'Ewa Krzyżewska', 'Wacław Zastrzeżynski', 'Adam Pawlikowski', 'Bogumił Kobiela', 'Jan Ciecierski', 'Stanisław Milski', 'Artur Młodnicki', 'Halina Kwiatkowska', 'Ignacy Machowski', 'Zbigniew Skowroński', 'Barbara Krafftówna', 'Aleksander Sewruk', 'Zofia Czerwińska', 'Irena Orzecka', 'Halina Siekierko', 'Grażyna Staniszewska', 'Jerzy Adamczyk', 'Adolf Chronicki', 'Wiktor Grotowicz', 'Mieczysław Łoza', 'Tadeusz Kalinowski', 'Ferdynand Matysik', 'Józef Pieracki', 'Ryszard Pietruski', 'Jerzy Jogałła', 'Juliusz Grabowski'];['Andrzej Wajda', 'Jerzy Andrzejewski'];['Halina Nawrocka'];['Jerzy Wójcik'];"It's May 1945, and Nazi Germany has just surrendered. The war is over, but not in Poland. As the German soldiers vacate, the remaining Russian forces and Polish resistance fighters must work out the hierarchies of power in ""liberated"" Communist Poland. A Polish assassin is given orders to kill a Russian soldier whom he, days before, was fighting alongside, and this moral conflict makes him question the goals for which he has been fighting."
3175;Barry Lyndon;18.744;8.001;1975;185;United Kingdom;Deutsch;11000000;198992;['Drama', 'Romance', 'War'];['Stanley Kubrick'];"[""Ryan O'Neal"", 'Marisa Berenson', 'Patrick Magee', 'Hardy Krüger', 'Diana Körner', 'Gay Hamilton', 'Frank Middlemass', ""Arthur O'Sullivan"", 'Godfrey Quigley', 'Leonard Rossiter', 'Philip Stone', 'Steven Berkoff', 'Marie Kean', 'Murray Melvin', 'André Morell', 'Leon Vitali', 'Billy Boyle', 'John Bindon', 'Roger Booth', 'Jonathan Cecil', 'Peter Cellier', 'Geoffrey Chater', 'Anthony Dawes', 'Patrick Dawson', 'Bernard Hepton', 'Anthony Herrick', 'Barry Jackson', 'Wolf Kahler', 'Pat Laffan', 'Hans Meyer', 'Ferdy Mayne', 'David Morley', 'Liam Redmond', 'Pat Roach', 'Dominic Savage', 'Frederick Schiller', 'George Sewell', 'Anthony Sharp', 'John Sharp', 'Roy Spencer', 'John Sullivan', 'Harry Towb', 'Michael Hordern']";['Stanley Kubrick'];['Tony Lawson'];['John Alcott'];An Irish rogue uses his cunning and wit to work his way up the social classes of 18th century England, transforming himself from the humble Redmond Barry into the noble Barry Lyndon.
78;Blade Runner;40.997;7.929;1982;118;United States of America;English;28000000;41722424;['Science Fiction', 'Drama', 'Thriller'];['Ridley Scott'];['Harrison Ford', 'Rutger Hauer', 'Sean Young', 'Edward James Olmos', 'M. Emmet Walsh', 'Daryl Hannah', 'William Sanderson', 'Brion James', 'Joe Turkel', 'Joanna Cassidy', 'James Hong', 'Kevin Thompson', 'Hy Pyke', 'Kimiko Hiroshige', 'Ben Astar', 'Dawna Lee Heising', 'Alexis Rhee', 'Bob Okazaki', 'Morgan Paull', 'John Edward Allen', 'Carolyn DeMirjian', 'Judith Burnett', 'Leo Gorcey Jr.', 'Sharon Hesky', 'Kelly Hine', 'Tom Hutchinson', 'Charles Knapp', 'Rose Mascari', 'Jirô Okazaki', 'Steve Pope', 'Robert Reiter'];['Hampton Fancher', 'David Webb Peoples'];['Marsha Nakashima'];['Jordan Cronenweth'];In the smog-choked dystopian Los Angeles of 2019, blade runner Rick Deckard is called out of retirement to terminate a quartet of replicants who have escaped to Earth seeking their creator for a way to extend their short life spans.
899;Broken Blossoms;10.275;7.0;1919;89;United States of America;No Language;0;2400000;['Drama', 'Romance'];['D.W. Griffith'];['Lillian Gish', 'Richard Barthelmess', 'Donald Crisp', 'Arthur Howard', 'Edward Peil Sr.', 'George Beranger', 'Norman Selby'];[];['James Smith'];['Billy Bitzer'];The love story of an abused English girl and a Chinese Buddhist in a time when London was a brutal and harsh place to live.
289;Casablanca;32.565;8.166;1942;102;United States of America;Deutsch;878000;10462500;['Drama', 'Romance'];['Michael Curtiz'];"['Humphrey Bogart', 'Ingrid Bergman', 'Paul Henreid', 'Claude Rains', 'Conrad Veidt', 'Sydney Greenstreet', 'Peter Lorre', 'S.Z. Sakall', 'Madeleine Lebeau', 'Dooley Wilson', 'Joy Page', 'John Qualen', 'Leonid Kinskey', 'Curt Bois', 'Enrique Acosta', 'Ed Agresti', 'Louis V. Arco', 'Frank Arnold', 'Leon Belasco', 'Nino Bellini', 'Oliver Blake', 'Monte Blue', 'Eugene Borden', 'Dick Botiller', 'Maurice Brierre', 'Sebastian Cabot', 'Anita Camargo', 'George M. Carleton', 'Spencer Chan', 'Melie Chang', 'Tex Cooper', 'Gino Corrado', 'Franco Corsaro', ""Adrienne D'Ambricourt"", 'Marcel Dalio', 'Helmut Dantine', 'Jean De Briac', 'George Dee', 'Jean Del Val', 'Carl Deloro', 'Joseph DeVillard', 'Arthur Dulac', 'William Edmunds', 'Herbert Evans', 'Fred Farrell', 'Adolph Faylauer', 'O.K. Ford', 'Martín Garralaga', 'Gregory Gaye', 'Gregory Golubeff', 'Ilka Grüning', 'Creighton Hale', 'Winifred Harris', 'Jamiel Hasson', 'Arthur Stuart Hull', 'Olaf Hytten', 'Charles La Torre', 'George J. Lewis', 'Manuel Lopez', 'Jacques Lory', 'Lou Marcelle', 'Tony Martelli', 'George Meeker', 'Lal Chand Mehra', 'Hercules Mendez', 'Louis Mercier', 'Torben Meyer', 'Alberto Morin', 'Leo Mostovoy', 'Corinna Mura', 'Barry Norton', 'Lotte Palfi Andor', 'Paul Panzer', 'Manuel París', 'Alexander Pollard', 'Frank Puglia', 'Georges Renavent', 'Dewey Robinson', 'Richard Ryen', 'Dan Seymour', 'Lester Sharpe', 'Dina Smirnova', 'Gerald Oliver Smith', 'George Sorel', 'Geoffrey Steele', 'Ludwig Stössel', 'Mike Tellegen', 'Rafael Trujillo', 'Jacques Vanaire', 'Ellinor Vanderveer', 'Norma Varden', 'Hans Heinrich von Twardowski', 'Jack Wise', 'Wolfgang Zilzer', 'Trude Berliner', 'Paul Porcasi', 'Max Linder', 'Frank Mazzola', 'Henry Rowland', 'Leo White', 'Paul Irving', 'Brandon Beach', 'Victor Romito', 'Michael Mark', 'Bhogwan Singh']";['Julius J. Epstein', 'Philip G. Epstein', 'Howard Koch'];['Owen Marks'];['Arthur Edeson'];In Casablanca, Morocco in December 1941, a cynical American expatriate meets a former lover, with unforeseen complications.
27019;Céline and Julie Go Boating;7.862;6.9;1974;193;France;Français;0;0;['Comedy', 'Drama', 'Fantasy'];['Jacques Rivette'];['Juliet Berto', 'Dominique Labourier', 'Bulle Ogier', 'Marie-France Pisier', 'Barbet Schroeder', 'Nathalie Asnar', 'Marie-Thérèse Saussure', 'Philippe Clévenot', 'Anne Zamire', 'Jean Douchet', 'Adèle Taffetas', 'Monique Clément', 'Jérôme Richard', 'Michael Graham', 'Jean-Marie Sénia'];[];['Nicole Lubtchansky'];[];A mysteriously linked pair of young women find their daily lives pre-empted by a strange boudoir melodrama that plays itself out in a hallucinatory parallel reality.
1686;Chelsea Girls;2.592;5.5;1966;210;United States of America;English;3000;0;['Drama'];['Andy Warhol', 'Paul Morrissey'];"['Brigid Berlin', 'Randy Borscheidt', 'Christian Aaron Boulogne', ""Angelina 'Pepper' Davis"", 'Dorothy Dean', 'Eric Emerson', 'Patrick Flemming', 'Ed Hood', 'Arthur Loeb', 'Donald Lyons', 'Gerard Malanga', 'Marie Menken', 'Mario Montez', 'Nico', 'Ondine', 'Rona Page', 'Albert Rene Ricard', 'Ronna', 'Edie Sedgwick', 'Ingrid Superstar', 'International Velvet', 'Mary Woronov']";[];[];[];Lacking a formal narrative, Warhol's mammoth film follows various residents of the Chelsea Hotel in 1966 New York City. The film was intended to be screened via dual projector set-up.
829;Chinatown;28.417;7.919;1974;130;United States of America;Español;6000000;30000000;['Crime', 'Drama', 'Mystery', 'Thriller'];['Roman Polanski'];"['Jack Nicholson', 'Faye Dunaway', 'John Huston', 'Perry Lopez', 'John Hillerman', 'Diane Ladd', 'Roman Polanski', 'Roy Jenson', 'Richard Bakalyan', 'James Hong', 'Bruce Glover', 'Joe Mantell', 'Roy Roberts', 'Noble Willingham', 'Rance Howard', 'Jesse Vint', 'Burt Young', 'Lee de Broux', 'Darrell Zwerling', 'Nandu Hinds', ""James O'Rear"", 'Beulah Quo', 'Jerry Fujikawa', 'Belinda Palmer', 'Elliott Montgomery', 'George Justin', 'C.O. Erickson', 'Charles Knapp', 'Claudio Martínez', 'Federico Roberto', 'Allan Warnick', 'John Holland', 'Jim Burk', 'Denny Arnold', 'Elizabeth Harding', 'John Rogers', 'Cecil Elliott', 'Paul Jenkins', 'Bob Golden', 'Richard Warren', 'Fritzi Burr', 'Cosmo Sardo']";['Robert Towne'];"[""Sam O'Steen""]";['John A. Alonzo'];Private eye Jake Gittes lives off of the murky moral climate of sunbaked, pre-World War II Southern California. Hired by a beautiful socialite to investigate her husband's extra-marital affair, Gittes is swept into a maelstrom of double dealings and deadly deceits, uncovering a web of personal and political scandals that come crashing together.
84972;Chronicle of a Summer;3.76;7.19;1961;87;France;Français;0;0;['Documentary'];['Edgar Morin', 'Jean Rouch'];['Edgar Morin', 'Jean Rouch', 'Marceline Loridan-Ivens', 'Nadine Ballot', 'Marilù Parolini', 'Jean-Pierre Sergent', 'Régis Debray'];[];['Jean Ravel', 'Françoise Collin', 'Néna Baratier'];['Raoul Coutard', 'Jean-Jacques Tarbès', 'Michel Brault', 'Roger Morillière'];Paris, summer of 1960. Anthropologist and filmmaker Jean Rouch, along with sociologist and film critic Edgar Morin, both assisted by Marceline and Nadine, roam the crowded streets asking ordinary people how they deal with the misfortunes of life. Are you happy? But their real purpose is to find out if people can speak sincerely in front of a camera and how they react when they are later invited to analyze the meaning of their answers.
6619;Death in Venice;9.631;7.35;1971;130;France;Deutsch;0;0;['Drama', 'History'];['Luchino Visconti'];['Dirk Bogarde', 'Romolo Valli', 'Mark Burns', 'Nora Ricci', 'Marisa Berenson', 'Carole André', 'Björn Andrésen', 'Silvana Mangano', 'Leslie French', 'Franco Fabrizi', 'Antonio Apicella', 'Sergio Garfagnoli', 'Ciro Cristofoletti', 'Luigi Battaglia', 'Dominique Darel', 'Masha Predit', 'Eva Axén', 'Marcello Bonini Olas', 'Bruno Boschetti', 'Nicoletta Elmi', 'John Fordyce', 'Karl Menzel', 'Mirella Pamphili', 'Howard Nelson Rubien', 'Marco Tulli', 'Bill Vanders'];['Luchino Visconti', 'Nicola Badalucco'];['Ruggero Mastroianni'];['Pasqualino De Santis'];Composer Gustav von Aschenbach travels to Venice for health reasons. There, he becomes obsessed with the stunning beauty of an adolescent Polish boy named Tadzio who is staying with his family at the same Grand Hôtel des Bains on the Lido as Aschenbach.
43376;Diary of a Country Priest;8.352;7.513;1951;115;France;Français;0;0;['Drama'];['Robert Bresson'];['Claude Laydu', 'Jean Riveyre', 'Adrien Borel', 'Rachel Bérendt', 'Nicole Maurey', 'Nicole Ladmiral', 'Martine Lemaire', 'Antoine Balpêtré', 'Jean Danet', 'Gaston Séverin', 'Yvette Etiévant', 'Bernard Hubrenne', 'Léon Arvel', 'Martial Morange', 'Gilberte Terbois', 'Serge Bento', 'Germaine Stainval', 'François Valorbe'];['Robert Bresson'];['Paulette Robert'];['Léonce-Henri Burel'];An inexperienced, sickly priest shows up in the rural French community of Ambricourt, where he joins the community's clergy. But the locals don't take kindly to the priest, and his ascetic ways and unsociable demeanor make him an outcast. During Bible studies at the nearby girls school, he is continually mocked by his students. Then his attempt to intervene in a family feud backfires into a scandal. His failures, compounded with his declining health, begin to erode his faith.
5998;Dr. Mabuse, the Gambler;8.077;7.675;1922;271;Germany;No Language;0;0;['Crime', 'Drama', 'Mystery', 'Thriller'];['Fritz Lang'];['Rudolf Klein-Rogge', 'Aud Egede-Nissen', 'Gertrude Welcker', 'Alfred Abel', 'Bernhard Goetzke', 'Paul Richter', 'Robert Forster-Larrinaga', 'Hans Adalbert Schlettow', 'Georg John', 'Károly Huszár', 'Grete Berger', 'Julius Falkenstein', 'Lydia Potechina', 'Julius E. Herrmann', 'Julietta Brandt', 'Max Adalbert', 'Anita Berber', 'Paul Biensfeldt', 'Gustav Botz', 'Lil Dagover', 'Heinrich Gotho', 'Leonhard Haskel', 'Erner Huebsch', 'Gottfried Huppertz', 'Hans Junkermann', 'Adolf Klein', 'Erich Pabst', 'Edgar Pauly', 'Karl Platen', 'Auguste Prasch-Grevenberg', 'Adele Sandrock', 'Willy Schmidt-Gentner', 'Hans Sternberg', 'Olaf Storm', 'Oscar Stribolt', 'Erich Walter'];['Fritz Lang', 'Thea von Harbou', 'Norbert Jacques'];[];['Carl Hoffmann'];Dr. Mabuse and his organization of criminals are in the process of completing their latest scheme, a theft of information that will allow Mabuse to make huge profits on the stock exchange. Afterwards, Mabuse disguises himself and attends the Folies Bergères show, where Cara Carozza, the main attraction of the show, passes him information on Mabuse's next intended victim, the young millionaire Edgar Hull. Mabuse then uses psychic manipulation to lure Hull into a card game where he loses heavily. When Police Commissioner von Wenk begins an investigation of this mysterious crime spree, he has little to go on, and he needs to find someone who can help him.
43344;Él;5.897;7.718;1953;92;Mexico;Español;0;0;['Drama', 'Thriller', 'Romance'];['Luis Buñuel'];['Arturo de Córdova', 'Delia Garcés', 'Aurora Walker', 'Carlos Martínez Baena', 'Manuel Dondé', 'Rafael Banquells', 'Fernando Casanova', 'José Pidal', 'Roberto Meyer', 'Luis Beristáin', 'León Barroso', 'Antonio Bravo', 'Ignacio Peón', 'Enedina Díaz de León', 'María Gentil Arcos', 'Leonor Gómez', 'María Herrero', 'Chel López', 'Álvaro Matute', 'Inés Murillo', 'José Muñoz', 'Isabel Herrera', 'Georgina González', 'Jorge Chesterking', 'Polo Ramos'];[];['Carlos Savage'];['Gabriel Figueroa'];Francisco is rich, rather strict on principles, and still a bachelor. After meeting Gloria by accident, he is suddenly intent on her becoming his wife and courts her until she agrees to marry him. Francisco is a dedicated husband, but little by little his passion starts to exhibit disturbing traits. Nevertheless, Gloria meets with scepticism as she expresses her worries to their acquaintances.
1871;Fantomas;12.927;6.822;1964;99;France;Français;0;0;['Comedy', 'Crime', 'Adventure', 'Fantasy'];['André Hunebelle'];['Jean Marais', 'Louis de Funès', 'Mylène Demongeot', 'Jacques Dynam', 'Robert Dalban', 'Marie-Hélène Arnaud', 'Anne-Marie Peysson', 'Christian Toma', 'Michel Duplaix', 'Andrée Tainsy', 'Hugues Wanner', 'Henri Attal', 'Jacques Berger', 'Pierre Collet', 'Henri Guégan', 'Rudy Lenoir', 'Jacques de Lanoye', 'Jean Minisini', 'Bernard Musson', 'Dominique Zardi', 'Yvan Chiffre'];['Jean Halain', 'Pierre Foucaud'];['Jean Feyte'];['Marcel Grignon'];Fantômas is a man of many disguises. He uses maquillage as a weapon. He can impersonate anyone using an array of masks and can create endless confusion by constantly changing his appearance.
35227;Foolish Wives;4.305;6.674;1922;143;United States of America;No Language;1100000;400200;['Drama'];['Erich von Stroheim'];['Erich von Stroheim', 'Rudolph Christians', 'Miss DuPont', 'Maude George', 'Mae Busch', 'Dale Fuller', 'Cesare Gravina', 'Malvina Polo', 'Albert Edmondson', 'Mary Philbin', 'Nigel De Brulier', 'C.J. Allen', 'Robert Edeson', 'Agnes Emerson', 'Louise Emmons', 'Harrison Ford', 'Mrs. Kent', 'Edward Reinach', 'Louis K. Webb'];[];['Arthur Ripley'];['William H. Daniels', 'Ben F. Reynolds'];“Count” Karamzin, a Don Juan, lives off the money he scams from rich ladies who are attracted by his charms and his title. Having set up shop in Monte Carlo, he and his partners in crime pick their next target: the wife of an American diplomat.
